{"limitations":["Deterministic projected-radius law; seed does not create biological replicates.","Circular planar observation, not curvature-corrected corneal surface area.","No cell-layer, chemical transport, stromal, barrier or drug-response validation.","Published point estimates; uncertainty and protocol differences remain.","Experimental checks are scoped evidence, not a global clinical approval."],"origin":"simulation","outputs":[{"name":"projected_radius","schema_version":"1.0.0","unit":"micrometer","values":[3500.0,3500.0,3500.0,3500.0,3500.0,3500.0,3500.0,3500.0,3500.0,3500.0,3500.0,3500.0,3500.0,3500.0,3500.0,3500.0,3500.0,3500.0,3500.0,3500.0,3500.0,3500.0,3500.0,3484.0,3468.0,3452.0,3436.0,3420.0,3404.0,3388.0,3372.0,3356.0,3340.0,3324.0,3308.0,3292.0,3276.0,3260.0,3244.0,3228.0,3212.0,3196.0,3180.0,3164.0,3148.0,3132.0,3116.0,3100.0,3084.0,3068.0,3052.0,3036.0,3020.0,3004.0,2988.0,2972.0,2956.0,2940.0,2924.0,2908.0,2892.0,2876.0,2860.0,2844.0,2828.0,2812.0,2796.0,2780.0,2764.0,2748.0,2732.0,2716.0,2700.0,2684.0,2668.0,2652.0,2636.0,2620.0,2604.0,2588.0,2572.0,2556.0,2540.0,2524.0,2508.0,2492.0,2476.0,2460.0,2444.0,2428.0,2412.0,2396.0,2380.0,2364.0,2348.0,2332.0,2316.0,2300.0,2284.0,2268.0,2252.0,2236.0,2220.0,2204.0,2188.0,2172.0,2156.0,2140.0,2124.0,2108.0,2092.0,2076.0,2060.0,2044.0,2028.0,2012.0,1996.0,1980.0,1964.0,1948.0,1932.0,1916.0,1900.0,1884.0,1868.0,1852.0,1836.0,1820.0,1804.0,1788.0,1772.0,1756.0,1740.0,1724.0,1708.0,1692.0,1676.0,1660.0,1644.0,1628.0,1612.0,1596.0,1580.0,1564.0,1548.0,1532.0,1516.0,1500.0,1484.0,1468.0,1452.0,1436.0,1420.0,1404.0,1388.0,1372.0,1356.0,1340.0,1324.0,1308.0,1292.0,1276.0,1260.0,1244.0,1228.0,1212.0,1196.0,1180.0,1164.0,1148.0,1132.0,1116.0,1100.0,1084.0,1068.0,1052.0,1036.0,1020.0,1004.0,988.0,972.0,956.0,940.0,924.0,908.0,892.0,876.0,860.0,844.0,828.0,812.0,796.0,780.0,764.0,748.0,732.0,716.0,700.0,684.0,668.0,652.0,636.0,620.0,604.0,588.0,572.0,556.0,540.0,524.0,508.0,492.0,476.0,460.0,444.0,428.0,412.0,396.0]},{"name":"projected_area","schema_version":"1.0.0","unit":"micrometer ** 2","values":[38484510.006474964,38484510.006474964,38484510.006474964,38484510.006474964,38484510.006474964,38484510.006474964,38484510.006474964,38484510.006474964,38484510.006474964,38484510.006474964,38484510.006474964,38484510.006474964,38484510.006474964,38484510.006474964,38484510.006474964,38484510.006474964,38484510.006474964,38484510.006474964,38484510.006474964,38484510.006474964,38484510.006474964,38484510.006474964,38484510.006474964,38133455.876992226,37784010.24294813,37436173.10434267,37089944.461175844,36745324.313447654,36402312.66115811,36060909.5043072,35721114.84289493,35382928.67692129,35046351.006386295,34711381.83128994,34378021.15163222,34046268.967413135,33716125.27863269,33387590.085290886,33060663.38738772,32735345.18492319,32411635.477897298,32089534.266310036,31769041.55016142,31450157.329451445,31132881.604180105,30817214.374347404,30503155.639953338,30190705.40099791,29879863.657481123,29570630.409402974,29263005.65676346,28956989.39956259,28652581.637800347,28349782.371476747,28048591.60059179,27749009.325145468,27451035.54513778,27154670.260568734,26859913.471438326,26566765.177746557,26275225.379493427,25985294.07667893,25696971.269303076,25410256.95736585,25125151.14086727,24841653.81980733,24559764.994186025,24279484.664003357,24000812.82925933,23723749.48995394,23448294.646087185,23174448.29765907,22902210.444669593,22631581.08711875,22362560.22500655,22095147.858332988,21829343.98709806,21565148.611301776,21302561.730944127,21041583.346025117,20782213.456544742,20524452.062503006,20268299.16389991,20013754.76073545,19760818.85300963,19509491.440722447,19259772.5238739,19011662.10246399,18765160.17649272,18520266.74596009,18276981.8108661,18035305.371210743,17795237.426994022,17556777.978215944,17319927.0248765,17084684.566975698,16851050.604513533,16619025.137490004,16388608.165905116,16159799.689758863,15932599.70905125,15707008.223782275,15483025.233951937,15260650.739560235,15039884.740607174,14820727.23709275,14603178.229016965,14387237.716379818,14172905.699181305,13960182.177421434,13749067.1511002,13539560.620217605,13331662.584773647,13125373.044768324,12920692.000201643,12717619.4510736,12516155.397384193,12316299.839133425,12118052.776321296,11921414.208947802,11726384.137012947,11532962.560516732,11341149.479459153,11150944.893840214,10962348.80365991,10775361.208918246,10589982.10961522,10406211.505750831,10224049.39732508,10043495.784337968,9864550.666789493,9687214.044679657,9511485.918008458,9337366.286775898,9164855.150981976,8993952.510626689,8824658.365710042,8656972.716232033,8490895.562192664,8326426.903591931,8163566.740429834,8002315.072706378,7842671.90042156,7684637.223575379,7528211.042167836,7373393.35619893,7220184.165668664,7068583.470577034,6918591.270924044,6770207.566709691,6623432.357933976,6478265.644596898,6334707.426698458,6192757.704238658,6052416.4772174945,5913683.745634969,5776559.509491081,5641043.768785832,5507136.523519221,5374837.773691248,5244147.519301912,5115065.7603512155,4987592.496839155,4861727.728765734,4737471.456130951,4614823.678934805,4493784.397177298,4374353.610858428,4256531.319978196,4140317.5245366027,4025712.2245336473,3912715.419969329,3801327.1108436496,3691547.2971566077,3583375.978908204,3476813.1560984384,3371858.8287273105,3268512.9967948208,3166775.660300969,3066646.8192457547,2968126.4736291794,2871214.623451241,2775911.2687119413,2682216.4094112795,2590130.045549255,2499652.1771258693,2410782.8041411215,2323521.926595011,2237869.5444875387,2153825.6578187044,2071390.2665885086,1990563.3707969505,1911344.9704440301,1833735.0655297479,1757733.6560541037,1683340.7420170973,1610556.323418729,1539380.4002589984,1469812.9725379061,1401854.040255452,1335503.6034116354,1270761.6620064569,1207628.2160399165,1146103.2655120138,1086186.8104227495,1027878.8507721229,971179.3865601342,916088.4177867837,862605.9444520711,810731.9665559964,760466.4840985597,711809.4970797609,664761.0054996003,619321.0093580774,575489.5086551927,533266.5033909458,492651.99356533703]},{"name":"open_area_fraction","schema_version":"1.0.0","unit":"dimensionless","values":[1.0,1.0,1.0,1.0,1.0,1.0,1.0,1.0,1.0,1.0,1.0,1.0,1.0,1.0,1.0,1.0,1.0,1.0,1.0,1.0,1.0,1.0,1.0,0.9908780408163266,0.9817978775510204,0.9727595102040817,0.9637629387755103,0.954808163265306,0.9458951836734694,0.937024,0.928194612244898,0.9194070204081632,0.9106612244897959,0.901957224489796,0.8932950204081633,0.8846746122448981,0.8760960000000001,0.8675591836734693,0.8590641632653061,0.8506109387755102,0.8421995102040816,0.8338298775510204,0.8255020408163266,0.817216,0.8089717551020409,0.8007693061224491,0.7926086530612244,0.7844897959183673,0.7764127346938775,0.7683774693877551,0.760384,0.7524323265306122,0.7445224489795919,0.7366543673469388,0.7288280816326531,0.7210435918367346,0.7133008979591836,0.7055999999999999,0.6979408979591837,0.6903235918367346,0.6827480816326531,0.6752143673469388,0.6677224489795919,0.6602723265306123,0.6528640000000001,0.645497469387755,0.6381727346938775,0.6308897959183674,0.6236486530612245,0.616449306122449,0.6092917551020408,0.602176,0.5951020408163266,0.5880698775510205,0.5810795102040816,0.5741309387755101,0.5672241632653061,0.5603591836734694,0.553536,0.546754612244898,0.5400150204081633,0.533317224489796,0.526661224489796,0.5200470204081633,0.5134746122448979,0.506944,0.5004551836734693,0.4940081632653061,0.4876029387755102,0.4812395102040817,0.47491787755102044,0.4686380408163266,0.4624000000000001,0.45620375510204075,0.4500493061224489,0.44393665306122443,0.43786579591836733,0.43183673469387757,0.4258494693877551,0.419904,0.4140003265306123,0.4081384489795919,0.4023183673469387,0.39654008163265303,0.39080359183673463,0.3851088979591836,0.379456,0.3738448979591837,0.3682755918367347,0.3627480816326531,0.35726236734693884,0.3518184489795919,0.34641632653061216,0.34105599999999997,0.33573746938775506,0.33046073469387754,0.32522579591836737,0.3200326530612245,0.314881306122449,0.30977175510204086,0.30470400000000003,0.2996780408163265,0.2946938775510204,0.2897515102040816,0.2848509387755102,0.2799921632653061,0.2751751836734694,0.27040000000000003,0.265666612244898,0.2609750204081633,0.256325224489796,0.2517172244897959,0.24715102040816328,0.24262661224489793,0.238144,0.2337031836734694,0.22930416326530614,0.22494693877551022,0.22063151020408162,0.2163578775510204,0.21212604081632652,0.207936,0.20378775510204078,0.19968130612244897,0.1956166530612245,0.19159379591836737,0.18761273469387757,0.18367346938775508,0.179776,0.17592032653061224,0.17210644897959185,0.1683343673469388,0.16460408163265305,0.16091559183673468,0.15726889795918367,0.15366400000000002,0.1501008979591837,0.1465795918367347,0.14310008163265306,0.1396623673469388,0.13626644897959186,0.13291232653061222,0.1296,0.1263294693877551,0.12310073469387756,0.11991379591836736,0.11676865306122447,0.11366530612244898,0.11060375510204082,0.10758400000000001,0.10460604081632655,0.1016698775510204,0.09877551020408162,0.09592293877551021,0.09311216326530614,0.09034318367346937,0.08761599999999999,0.08493061224489795,0.08228702040816327,0.07968522448979592,0.0771252244897959,0.07460702040816326,0.07213061224489796,0.06969600000000001,0.0673031836734694,0.06495216326530612,0.0626429387755102,0.060375510204081634,0.058149877551020406,0.05596604081632653,0.053824000000000004,0.051723755102040817,0.04966530612244898,0.04764865306122448,0.04567379591836735,0.04374073469387755,0.0418494693877551,0.04000000000000001,0.03819232653061224,0.03642644897959184,0.034702367346938774,0.03302008163265306,0.03137959183673469,0.029780897959183674,0.028224000000000003,0.026708897959183672,0.025235591836734697,0.02380408163265306,0.022414367346938777,0.021066448979591833,0.019760326530612243,0.018496000000000002,0.017273469387755102,0.016092734693877554,0.014953795918367348,0.01385665306122449,0.01280130612244898]},{"name":"closure_fraction","schema_version":"1.0.0","uni